{
  "schema_version": "1.0",
  "execution_id": "exe_0123456789abcdef0123456789abcdef",
  "tenant_id": "c601ce9c-0000-4000-8000-000000000001",
  "workspace_id": "ws_1",
  "status": "waiting_for_approval",
  "actor": {"type": "user", "id": "user_1"},
  "agent_ref": {"agent_id": "mkbank-support", "graph_id": "mkbank-support-main", "graph_version": "1.1.0", "served_version": "stable"},
  "thread_id": "thr_0f3c9d",
  "context_refs": [{"type": "deal", "id": "deal_1"}],
  "created_at": "2026-08-04T09:00:00Z",
  "updated_at": "2026-08-04T09:00:07Z",
  "cancel_requested": false,
  "waiting_for": {
    "kind": "approval",
    "interrupt_id": "int_7ab1",
    "expires_at": "2026-08-04T10:00:07Z"
  }
}
