{
  "schema_version": "1.0",
  "execution_id": "exe_ffffffffffffffffffffffffffffffff",
  "tenant_id": "c601ce9c-0000-4000-8000-000000000001",
  "status": "cancelled",
  "actor": {"type": "user", "id": "user_1"},
  "agent_ref": {"agent_template": "tool_agent"},
  "thread_id": "thr_aa11",
  "created_at": "2026-08-04T09:00:00Z",
  "updated_at": "2026-08-04T09:00:03Z",
  "completed_at": "2026-08-04T09:00:03Z",
  "cancel_requested": true
}
