{
  "schema_version": "1.0",
  "execution_id": "exe_0123456789abcdef0123456789abcde3",
  "tenant_id": "c601ce9c-0000-4000-8000-000000000001",
  "status": "created",
  "actor": {"type": "service", "id": "work-core"},
  "agent_ref": {"graph_id": "mkbank-support-main", "graph_version": "1.1.0"},
  "thread_id": "thr_0f3ca0",
  "origin": "observer",
  "correlation_id": "cor_0123456789abcdef0123456789abcde1",
  "handoff_depth": 0,
  "deadline_at": "2026-08-04T09:15:00Z",
  "context_refs": [{"type": "deal", "id": "deal_456"}],
  "created_at": "2026-08-04T09:00:00Z",
  "updated_at": "2026-08-04T09:00:00Z",
  "cancel_requested": false
}
