{
  "schema_version": "1.0",
  "execution_id": "exe_0123456789abcdef0123456789abcdef",
  "tenant_id": "c601ce9c-0000-4000-8000-000000000001",
  "status": "created",
  "actor": {"type": "user", "id": "user_1"},
  "agent_ref": {"graph_id": "mkbank-support-main", "graph_version": "1.1.0"},
  "thread_id": "thr_0f3c9d",
  "idempotency_key": "msg_1-sales_agent",
  "created_at": "2026-08-04T09:00:00Z",
  "updated_at": "2026-08-04T09:00:00Z",
  "cancel_requested": false
}
