{
  "schema_version": "1.0",
  "execution_id": "exe_1d5c880000000000000000000000000a",
  "tenant_id": "c601ce9c-0000-4000-8000-000000000001",
  "status": "completed",
  "actor": {
    "type": "service",
    "id": "work-core"
  },
  "agent_ref": {
    "graph_id": "mkbank-support-main",
    "graph_version": "1.1.0"
  },
  "thread_id": "thr_0f3c9d",
  "created_at": "2026-08-04T09:00:00Z",
  "updated_at": "2026-08-04T09:00:07Z",
  "completed_at": "2026-08-04T09:00:07Z",
  "cancel_requested": false,
  "result": {
    "output": {
      "type": "message",
      "text": "Bugun 11-avgust, payshanba."
    },
    "citations": [],
    "tool_calls": [
      "current_time"
    ],
    "proposed_actions": [],
    "usage": {
      "input_tokens": 210,
      "output_tokens": 18
    }
  },
  "operations": [],
  "operations_coverage": {
    "complete": true
  }
}
